Id,Category,Title,Ingredients,Steps,URL,Type,Temp(cold)
743,ayam,Creamy Chicken Soup With Toast,"250 gr dada ayam--1 buah wortel--1 buah brokoli yg kecil--1 buah kentang--2 helai daun bawang dan seledri--75 gr keju cheddar, parut--1 buah bawang bombay, iris memanjang--1/2 sdt pala bubuk--2 sdm krimer (saya pake fiber crime)--1 sdm tepung maizena--Secukupnya unsalted butter--Secukupnya garam dan merica bubuk--Utk kaldu :--2 siung bawang putih, memarkan--2 cm jahe, memarka--500 ml air--Pelengkap :--2 lembar roti tawar, panggang--","Cuci bersih dada ayam, lalu rebus sebentar selama 10 menit utk membuang kotorannya, buang air rebusannya. Setelah itu rebus kembali utk membuat kaldu bersama dengan bahan membuat kaldu.. masak sampe ayam matang, sisihkan.--Potong2 brokoli per kuntum, lalu rendam dengan air garam agar kotorannya keluar.--Bersihkan wortel dan kentang, potong dadu. Bersihkan juga daun bawang dan seledri iris halus.--Dada ayam yg sdh direbus matang, disuwir2 atau potong dadu, sisihkan.--Panaskan unsalted butter, tumis bawang bombai sampe harum, tambahkan garam, merica bubuk, pala bubuk, dan keju parut aduk cepat sampe merata masukan kaldu ayam, didihkan. Jangan lupa disaring ya kaldu ayamnya utk memisahkan ampas dari bahan pembuat kaldu..--Setelah mendidih masukan semua sayuran, masak selama 2 menit atau sampe matang tapi tdk lembek. Tes rasa klo dirasa kurang bisa tambahkan bumbu sesuai selera.--Larutkan krimer dan tepung maizena dengan sedikit air.--Setelah sayur dimasak sampe matang, tambahkan ayam yg sdh disuwir2 atau potong dadu, lalu tambahkan juga larutan krimer dan tepung maizena, aduk cepat sampe agak mengental. Angkat--Sajikan selagi hangat bersama dengan roti tawar yg sdh dipanggang.. atau garlic bread--",743_creamy_chicken_soup_with_toast.jpg,,
744,ayam,Bihun Rebus Ayam Geprek,1 potong ayam crispy (siap makan)--1 kotak bijun jagung (kecil)--1 sdm kecap asin--2 sdm minyak bawang (sisa bikin pangsit rebus)--1/4 sdt vetsin/micin (bisa di skip)--2 siung bawang putih--10 buah cabai rawit merah (sesuai selera)--2 sdm minyak sayur--Sedikit merica bubuk--Garam secukup nya--Gula secukup nya--,"Taru bumbu di mangkuk (kecap asin, merica bubuk, vetsin/micin, minyak bawang)--Rebus air smp mendidih, masukan bihun jagung masak sampai matang. Tiriskan..--Masukan bihun yg sudah matang ke dlm mangkuk berisi bumbu,aduk rata.--Ulek bawang putih, cabai rawit, garam + gula+ vetsin (bisa skip)secukup nya.--Panas kan 2 sdm minyak goreng sampai benar2 panas, lalu siram kan ke sambal.--Taruh ayam crispy di sambal lalu geprek/ulek,aduk sampai sambal tercampur bersama ayam.--Sajikan ayam geprek di atas bihun rebus.--",744_bihun_rebus_ayam_geprek.jpg,,
745,ayam,Nugget Ayam Simple Ala² Fiesta,1/4 Ayam (buang tulangnya)--9 lembar roti tawar (buang pinggirnya)--2 sendok tepung beras--2 siung bawang putih--1 wortel (sesuai Selera)--1 butir telur--Tepung toto (secukupnya)--Secukupnya garam--Secukupnya penyedap--,"Kupas wortel, kemudian parut dg parutan keju,--Belender jadi satu Ayam, roti tawar, wortel parut, bawang putih, garam, penyedap dg sedikit Air--Jika telah halus, tambahkan tepung beras aduk rata kemudian tes rasa.--Setelah rasa sesuai dan telah selesai taruh pada Loyang kemudian kukus kurleb 15 menit--Setelah matang, biarkan nugget agak dingin, kemudian potong2 sesuai selere--Telur kocok lepas, kemudian lumuri nugget yang tlah di potong2 dg kocokan telur, balur dg tepung roti kemudian goreng sampai warna keemasan--Dan nugget siap di santap, beri pedamping mayonis atau caos kesukaan anda  hidangkan selagi masih panas dan selamat mencoba --",745_nugget_ayam_simple_ala²_fiesta.jpg,,
746,ayam,Chicken Teriyaki,1 Dada ayam--secukupnya Daun bawang--1 buah bawang bombay--3 siung bawang putih--4 sdm saus teriyaki--2 sdm kecap asin--3 sdm kecap manis--secukupnya Lada bubuk--secukupnya Garam gula pasir--,"Potong dada ayam kecil2--Geprek bawang putih kemudian iris kecil2. Tumis hingga harum.--Masukkan ayam tumis sebentar.--Masukkan kecap asin, kecap manis, saus teriyaki, garam, gula, lada.--Tambahkan air kira2 500ml.--Tunggu hingga ayam matang dan kuah menyusut.--Setelah ayam matang dan kuah tinggal sedikit masukkan bawang bombay dan daun bawang yang sudah diiris memanjang. Tumis sebentar kemudian angkat.--Hidangkan--Nb: karena saya suka bawang bombay masih terasa teksturnya, saya masukkan terakhir. Jika suka bawang bombay yang matang bisa masukkan diawal bareng dengan bawang putih.--Selamat mencoba--",746_chicken_teriyaki.jpg,,
747,ayam,Spaghetti Creamy Tomat Ayam,"1/2 sdm bawangbombai cincang--1 siung bawang putih geprek cincang--Kaldu jamur--1/2 bh tomat potong""--Segenggam spaghetti merk Orgran--Daging ayam secukupnya cincang--2 sdm canola oil--Sediki ladaputih--Garlic powder--Keju Kraft cheddar untuk taburan--100 ml susu ultramilk full cream--Parsley flakes secukupnya *bole skip--","Memasak spaghetti :didihkan air.. Jika sudah mendidih masukan spaghetti beri minyak sedikit.. Jika sudah matang sisihkan dg Cara menyaringnya Dari air--Tumis bawang putih Dan bawangbombai hingga harum--Masukan ayam Dan tomat..aduk sampai matang--Masukan susu beri seasoning garlic powder, Ladaputih, kaldujamur Dan parsley aduk rata--Masukan spaghetti aduk"" hingga menyusut--Sajikan dengan parutan keju--",747_spaghetti_creamy_tomat_ayam.jpg,,
748,ayam,Ceker Ayam Dim Sum,1 kilo ceker ayam--Bumbu haluskan:--3 bawang merah--2 bawang putih--2 cm jahe--10 rawit merah--Bumbu pelengkap:--1 sdt angkak merah--3 biji bunga lawang--1 sdm saus tiram--1 sdt minyak wijen--2 sdm kecap manis--1/2 sdt kecap asin--2 sdm saus tomat--1 gelas air--1 sdt garam--1/2 sdt lada putih--2 sdm gula putih--Jika mau lebih pedas bisa masukan irisan rawit merah lagi--,"Bersihkan ceker dan potong kukunya. Masukan ke dalam panci presto--Masukan bumbu halus dan bumbu pelengkap, aduk rata--Tutup panci presto dan masak 30-45 menit--Angkat & Sajikan--",748_ceker_ayam_dim_sum.jpg,,
749,ayam,Ayam Woku,1/2 kg ayam--1 buah tomat--1 btg serai--3 lbr.daun jeruk--2 lbr daun salam--1 ikat kemangi--Bumbu halus :--4 cabai keriting--6 cabai rawit--7 bawang merah--3 bawah putih--1 ruas kunyit--1 ruas jahe--5 kemiri--Garam--Gula--,"Potong ayam menjadi beberapa bagian lalu cuci bersih--Haluskan bumbu lalu tumis sampai harum--Masukkan ayam, daun jeruk, serai, dan salam lalu tambahkan air secukupny--Beri garam dan gula sesua selera--Tunggu sampai air tinggal sedikit lalu masukkan irisan tomat dan kemangi--Biarkan sampai bumbu meresap--Setelah matang siap d hidangkan d makan dengan nasi hangat--",749_ayam_woku.jpg,,
750,ayam,Ayam Tahu Kemangi,secukupnya Ayam--4 buah Tahu putih--4 siung bawang putih--4 siung bawang merah--1 butir kemiri--1 buah sere--Setegah ruas kunyit--secukupnya Lengkuas--1 iket kemangi--1 buah Santen kara--Garam dapur penyedap rasa--,"Bersihkan ayam potong potong sesuai selerah anda. Setelahnya cuci bersih rebus sebentar saja 10 menit agar menghilangkan darahnya.--Tahu putih digoreng dahulu--Selanjutnya bumbu dihaluskan bawang merah, bawang putih, kunyit dan kemiri.geprek sere dan lengkuas kemudian tumiss hingga harum--Lalu beri air dan santan kara. Masukkan ayam yg telah direbus sebentar kedlm kuah lalu dimasukkan lagi tahu yg sdh digoreng.--Terakhir tambahkan kemangi dan penyedap rasa serta garam--Koreksi rasa dan sajikan bersama sambel dan nasi anget kerupuk jangan lupa hehee--",750_ayam_tahu_kemangi.jpg,,
751,ayam,Quiche Bayam Ayam Keto Ketofy Ketopad,50 gram bayam--100 gram ayam/tuna/sapi (me ayam)--50 gram keju parut--50 gram yogurt plain--2 butir telor--1 sdt bawang putih--Secukupnya lada halus--Secukupnya garam krosok--1 tangkai seledri--Secukupnya organo--,"Celup bayam pada rebusan air yang sudah mendidih, celup2 sampai setengah matang. Angkat, peras, iris2 lembut. Sisihkan.--Cincang lembut daging ayam. Sisihkan.--Kocok lepas telor sampai putih telur nya menyatu. Sisihkan.--Campur dalam 1 wadah. Bayam, telor, ayam. Masukkan pula bahan2 lainnya, bawang putih, lada halus, garam, keju parut, yogurt dan seledri. Aduk2 rata.--Masukkan dalam cetakan yang sudah diolesi butter.--Taburi atasnya dengan organo.--Kukus / panggang (me kukus) selama 15-20 menit. Kalau panggang biasanya lebih membutuhkan waktu lama.--Quiche siap disantap bisa dioles2 saos sambal keto.--",751_quiche_bayam_ayam_keto_ketofy_ketopad.jpg,,
752,ayam,Chicken Köfte,1 bh dada ayam utuh haluskan--6 siung bawang putih haluskan--1 bh bawang bombay rajang halus--2 sdt kari bubuk--1 sdm paprika bubuk--1/2 sdt kunyit bubuk--1/2 sdt ketumbar bubuk--1/2 merica bubuk--1 sdt garam--1/2 sdt gula pasir--1 btr telur--secukupnya minyak zaitun/minyak goreng--,"Campurkan semua bahan aduk hingga rata. Baluri tangan dg sedikit minyak goreng. Ambil sekepal adonan, bentuk bulat, pipihkan dg tinggi 1-1,5 cm dan diameter +/- 5 cm.--Tuangkan sedikit minyak ke atas panggangan datar/teflon. Panggang dg api kecil hingga matang atau cukup 1/2 matang bila akan disimpan dlm freezer. Yummy!--",752_chicken_köfte.jpg,,
753,ayam,Pare Ayam Daging Sapi,2 buah pare ayam--200 gr daging sapi (potong dadu)--2 cm jahe(iris korek api)--2 siung bawang putih (cincang)--1 sdm saos tiram--1 sdm kecap hitam--1 sdm kecap asin--1 sdm kecap manis--gula dan garam--,"Potong agak tebal pare lalu taburi garam,remas remas hingga layu,bilas air,tiriskan.--Tumis jahe dan bawang putih hingga wangi masukkan daging sapi,aduk rata bumbui saos tiram,kecap asin,kecap hitam,kecap manis aduk aduk hingga tercampur rata.--Masukkan pare aduk rata,tuang air bumbui gula dan garam.biarkan daging empuk dan pare matang.--Kecilkan api dan biarkan kuah surut.--Matikan api dan siap di sajikan.--",753_pare_ayam_daging_sapi.jpg,,
754,ayam,Hot Spicy Chicken Wings,250 gr sayap ayam--40 gr tepung hot spicy serbaguna--3 sdm saus sambal--2 sdm saus tomat--1 sdt kecap asin--1 butir telur ayam--1 sdm saus tiram--1 sdm madu--2 siung bawang putih--Secukupnya garam--1 sdm lada bubuk--1/2 buah lemon--Secukupnya penyedap rasa--1 sdm mentega--Secukupnya minyak goreng--Secukupnya tepung maizena--Secukupnya saus putih atau mayonais (untuk pelengkap saja)--,"Siapkan semua bahan yg ingin digunakan--Cuci bersih sayap ayam lalu marinade dengan lemon dan garam setelah itu balurkan sayap ke dalam telur dan tepung serbaguna lalu goreng--Bahan saus : tumis mentega masukkan bawang putih, saus sambal, saus tomat, kecap asin, saus tiram, garam, lada dan penyedap rasa lalu aduk hingga harum--Masukkan sayap yg sudah digoreng tadi kedalam bahan saus tadi--Aduk hingga rata lalu tambahkan tepung maizena yg sudah dilarutkan--Masak sayap hingga matang--Lalu tambahkan pelengkap seperti saus putih atau mayonais taburkan perasan lemon agar lebih seger--Hot spicy chicken wings siap disajikan--",754_hot_spicy_chicken_wings.jpg,,
755,ayam,Ayam Masak Mentega With Pete,"1/2 ekor ayam (aku gak pake bagian dada nya--2 papan pete--3 siung bawang putih, rajang--1 bh bombay--3 sdm margarin--2 btg daun iris serong--3 sdm kecap manis--1/2 sdm kecap inggris--1 sdm sambal + tomat--Garam--Penyedap--Air--Lada--","Bersihkan ayam, marinage dgn jeruk nipis,garam, lada dan garlic powder kurleb 20mnt, setelah itu goreng hingga matang sisihkan--Tumis bawang putih dan bombay hingga harum lalu masukkan ayam td dan pete nya aduk2 beri air secukupnya dan beri garam penyedap lada saus sambal, tomat, kecap manis dan kecap inggris, aduk2 lalu masak hingga mulai mengering dan minyak mulai mengeluar lalu terakhir masukkan daun bawang nya aduk dan sajikan--",755_ayam_masak_mentega_with_pete.jpg,,
756,ayam,Ayam Kecap Manis,1 kg ayam--4 siung Bawang putih--4 buah bawang merah--2 lmbar daun salam--2 sereh (geprek)--2 cm lengkuas--2 cm kunyit--Secukupnya kecap--Secukupnya garam--Secukupnya gula putih--Secukupnya air--Secukupnya penyedap rasa--Minyak untuk menumis--,"Haluskan bumbu2,sisihkan. Bersihkan ayam,sisihkan.--Tumis bumbu(minyak agak banyak),stlah harumm masukan ayam,dan diamkan bebberapa saat sambil diaduk beri sedikit air masukkan salam,sereh,garam. Tutup (ungkeub)--Setelah terlihat ayam empuk masukan kecap,gula. Aduk2. Masak lagii--Koreksi rasa, dan sajikann--",756_ayam_kecap_manis.jpg,,
757,ayam,Mie Ayam Simple,Mie kering--secukupnya Sawi--Bahan ayam:--250 gram daging ayam (pisahkan daging dengan tulang)--4 siung bawang merah--3 siung bawah putih--1 butir kemiri--3 ruas kunyit--2 ruas jahe--2 ruas lengkuas--2 lembar daun salam--2 lembar daun jeruk--1 batang lengkuas--secukupnya Ketumbar--secukupnya Merica--secukupnya Garam--secukupnya Gula--secukupnya Kecap manis--Bahan kuah:--Tulang ayam--1 liter air--4 siung bawang putih--1 batang bawang daun--secukupnya Merica--secukupnya Garam--,"Ayam:--Potong daging ayam kecil-kecil--Haluskan bumbu (bawang merah, bawang putih, ketumbar, merica, kunyit, kemiri)--Tumis bumbu hingga harum. Masukkan lengkuas, serai, jahe (geprek dulu), daun jeruk dan daun salam--Masukkan daging ayam--Tambahkan air kaldu ayam (tulang ayam tadi direbus dan ambil sedikit kuahnya)--Tambahkan garam, gula, dan kecap secukupnya--Masak hingga matang--Kuah:--Rebus tulang ayam--Sembari menunggu kaldu mendidih, goreng bawang putih dan bawang daun hingga sedikit kecoklatan--Haluskan bawang putih dan bawang daun yang telah digoreng lalu masukkan ke rebusan tulang ayam--Tambahkan garam dan cicipi rasanya--Penyajian:--Rebus mie dan sawi hingga hampir matang--Masukkan ke dalam mangkok, tambahkan kuah, ayam dan saos sambal--Sajikan selagi panas--",757_mie_ayam_simple.jpg,,
758,ayam,Ayam Bakar Teflon,"1/2 kg ayam dada, potong jd 6 bagian--4 siung bawang putih--4 siung bawang merah--5 butir kemiri--3 biji cabe merah besar, buang isinya--2 buah tomat merah ukuran sedang--1 sendok makan Gula pasir--1/2 sendok teh garam dapur--1/2 sendok teh trasi matang--1 sachet royco ayam--1 sendok makan Gula merah disisir halus--1 ruas Laos digeprek,cuci bersih--2 lembar daun salam cuci bersih--1 sendok makan minyak sayur utk menumis--250 ml air putih--","Bumbu yg dihaluskan : bawang merah, bawang putih, cabe merah besar, kemiri, trasi, tomat, Dan air blender Jadi satu ya mom.--Cuci bersih dada ayam yg sudah dipotong tadi kemudian panggang diatas teflon Tanpa minyak. Panggang bagian Atas smp dirasa 1/2 matang baru dibalik bagian bawah jg ya mom Sama 1/2 matang. Selesaikan semua bagian 6 potong tadi. Selesai tiriskan.--Masukkan bumbu yg sudah dihaluskan tadi kedalam wajan, tumis bersama minyak lalu masukkan ayam yg sudah dipanggang tadi lalu beri Gula pasir, garam, Gula merah Dan royco ayam serta daun Salam, Laos.--Cek rasa ya mom sesuai selera masing"". Kalo menurut mom dirasa Kurang gurih boleh ditambahin sedikit garam juga Gula pasirnya.--Setelah tumisan ayam Dan bumbu mengental angkat Dan matikan Api.--Siapkan teflon yg Uda dipanaskan diatas Kompor ya mom pake Api sedang lalu ambil ayam yg sudah dibumbui tadi kemudian panggang diteflon. Balik jika dirasa warnanya merah kecoklatan ya mom. Panggang rata Atas bawah.--Matikan Api. Siap dipindah dipiring saji.--Selamat Mencoba ya mom.. --",758_ayam_bakar_teflon.jpg,,
759,ayam,Soto Ayam,8 potong ayam kampung--2 batang sereh--2 lembar daun salam--2 lembar daun jeruk--2 cm jahe geprek--1 cm lengkuas geprek--Secukupnya air--Kaldu bubuk--Bumbu uleg :--6 siung bawang merah--5 siung bawang putih--3 cm kunyit--Sejumput merica--6 butir kemiri sangrai--Secukupnya garam--Bahan untuk taburan :--1/4 kol--100 gram taoge--Daun bawang dan seledri--Jeruk nipis--Bawang goreng--,"Cuci bersih ayam lalu rebus hingga empuk.--Tumis bumbu uleg hingga harum. Tambahkan daun salam, daun jeruk, sereh, jahe, dan lengkuas.--Masukkan bumbu yang sudah ditumis ke dalam rebusan ayam. Masak hingga matang. Tambahkan kaldu bubuk. Tes rasa.--Rebus sebentar toge dan kol. Angkat. Kalau lebih suka mentah, bisa di skip untuk merebusnya.--Sajikan dengan bahan taburannya.--",759_soto_ayam.jpg,,
760,ayam,Mie Ayam Endeus,"1/2 ekor ayam--2 batang daun bawang--2 buah mie telur--Bumbu ayam:--4 siung bawang putih--7 siung bawang merah--3 butir kemiri--1 sdt ketumbar--1 ruas jari kunyit--1 sdt lada--(Bahan diatas dihaluskan yah)--2 lembar daun salam--2 lembar daun jeruk--2 batang sereh di geprek--2 ruas lengkuas d geprek--1 sdm kecap manis--1 sdm saos tiram--1/2 sdt garam--1 sdt gula pasir--Bumbu kuah mie ayam:--3 siung bawang putih di geprek--1 ruas jari jahe di geprek--1 sdt minyak wijen--(Saya,ayamnya direbus dsini supaya kaldunya terasa setelah matang sya angkat lalu suwir2)--Bahan utk di mangkuk penyajian:--1 sdt minyak asin--Sejumput sasa/ajinomoto (bsa d skip jika tdk mau)--Bahan sambal:--5 buah rawit merah--5 buah rawit hijau--2 buah cabe merah--(Rebus bahan diatas,lalu haluskan)--","Pertama2 rebus ayam dulu, masukkan jahe dan bawang putih yg sudah digeprek, jika sudah mendidih matikan kmpor. Angkat ayamnya, lalu potong2 dan sisihkan.--Panaskan wajan,beri minyak yg agak bnyak,supaya minyaknya bisa d pakai untuk tambahan bahan penyajian d mangkuk nanti. Jika sudah panas, tumis bumbu halus beserta lengkuas,sereh,daun salam dan daun jeruk. Aduk2 hingga harum. Kemudian masukkan daging ayam, aduk lagi hingga rata. Kemudian tambahkan air secukupnya. Tambahkan gula pasir,penyedap rasa, kecap manis, garam dan saus tiram. Masak hingga airnya agak menyusut. Kemudian matikan kompor.--Rebus mie telur,tingkat kematangan sesuai selera. Sishkan.--Penyajian: siapkan mangkuk, tambahkan kecap asin dan minyak dari ayam. Aduk2, beri sasa. Masukkan mie, aduk2 dengan sumpit hingga merata. Lalu tambahkan daging ayam dan daun bawang, beserta kuah dan sambal.--Silahkan dicoba buk ibuk...--",760_mie_ayam_endeus.jpg,,
761,ayam,Soto Ayam,8 buah bawang merah--2 siung bawang putih--2 buah bawang pre--2 buah kemiri--2 iris lengkuas yang sudah di tumbuk--1 ruas kunyit--2 buah serai yang sudah di tumbuk--4 helai daun jeruk purut--1 iris jahe--Ayam goreng yang sudah dipotong kecil dan tipis--Kaldu ayam--1 buah kentang yang sudah diiris tipis dan digoreng kering--Garam--Lada--,"Bawang merah, bawang putih dan kemiri digoreng hingga matang--Setelah matang, haluskan bawang merah, bawang putih dan kemiri tersebut dengan lada + kunyit.--Jika sudah halus, tumis bumbu diatas kemudian tambahkan lengkuas, serai dan daun jeruk purut. Tumis hingga harum dan sedikit kecoklatan--Rebus kaldu ayam dan ketika sudah mendidih, masukan bumbu yg sudah ditumis tadi ke dalam rebusan kaldu.--Tambahkan garam dan irisan bawang pre kedalam rebusan kaldu. Tunggu hingga 2 menit lalu angkat.--Untuk potongan ayam bisa ikut dimasukkan ke dalam rebusan kaldu, atau disajikan diatas piring. Sesuai dengan selera.--Sajikan bersama nasi hangat dan beri kentang yang sudah digoreng kering.--",761_soto_ayam.jpg,,
762,ayam,Ayam Woku,1 ekor ayam--6 bawang merah--4 bawang putih--4 kemiri--10 cabe merah (selera)--Kunyit secukupnya (kalau saya seukuran jari kelingking)--Lengkuas--Garam--Gula--2 sereh--Daun kemangi (secukupnya)--1 gelas Air--,"Haluskan bawang merah, bawang putih, cab merah, kunyit, kemiri, lengkuas (boleh di geprek).--Tumis bahan yg telah dihaluskan. Masukkan sereh. tumis sampai wangi.--Masukkan ayam. Masak sampai ayam berwarna pucat tidak ada darah.--Masukkan 1 gelas air, gula, garam. Tunggu sampai air agak menyusut dan ayam matang.--Masukkan daun kemangi, aduk 3 menit sampai kemangi agak layu--Ayam woku siap disantap.--",762_ayam_woku.jpg,,
763,ayam,Soto Ayam Sederhana,1/2 ekor ayam--1/2 kol--Jeruk nipis--2 bungkus soun--2 buah tomat--3 batang seledri dan daun bawang--Daun jeruk--Dau salam--2 buah serai--Bumbu uleg--2 buah bawang putih--5 buah bawang merah--2 buah kemiri--Jahe seruas kelingking--Kunyut seruas kelingking--Lengkuas geprek--,"Panaskan air masukan ayamnya, buang air nya separo tambahkan air lagi, angkat ayam lalu gorong.--Tumis bumbu uleg masukan lengkuas, serai daun salam, daun jeruk, jika sudah harum angkat masukan ke panci yg sudah dididihkan airnya.--Tunggu sampai matang mendidih.--Untuk sambal saya hanya pakai cabe rawit merah direbus lalu diuleg dehh.--",763_soto_ayam_sederhana.jpg,,
764,ayam,Ayam Lada Hitam,"1 bh dada ayam--1 bh bawang bombai--2 siung bawang putih--1 bh paprika merah--1 kaleng kecil jamur kancing--2 sdm kecap manis--1/2 sdm kecap asin--1 sdm minyak wijen--1 sdm Lada hitam tumbuk kasar--Garam, gula dan lada putih sckp--","Bersihkan ayam, potong dadu--Potong dadu paprika, bawang bombay dan jamur kancing--Tumis bawang bombai dan bawang putih yang sudah digeprek sampai harum--Masukkan ayam dan paprika, kecap manis dan kecap asin, lada hitam dan minyak wijen--Masukkan jamur, beri garam, gula, dan lada putih cek rasa masak hingga matang --",764_ayam_lada_hitam.jpg,,
765,ayam,Ayam Pok Pok Saos Telur Asin,"Ayam fillet secukupnya, cuci dan potong kecil--Bumbu ayam--1 siung bawang putih,haluskan--secukupnya Merica--secukupnya Garam--Tepung crispy--Bahan saos telur asin--1-2 kuning telur asin, hancurkan dengan sendok--2 siung bawang merah, iris-iris--2 siung bawang putih, iris-iris--1/2 ikat daun bawang, iris-iris--4 cabe merah, iris-iris--secukupnya Air--secukupnya Mentega--secukupnya Garam--Kaldu jamur (saya pake merk Totole)--","Fillet ayam yang sudah dipotong dicampur dengan bawang putih yang dihaluskan, garam, dan merica. Diamkan sekitar 30 menit--Siapkan tepung bumbu crispy dan bagi menjadi dua bagian yaitu tepung basah dan tepung kering--Masukkan potongan ayam ke tepung kering lalu ke tepung basah dan kembali ke tepung kering--Panaskan minyak lalu goreng ayam, tiriskan--Panaskan minyak lalu tumis bawang putih, bawang merah hingga harum--Tambahkan potongan daun bawang dan irisan cabe merah--Masukkan kuning telur, lalu masukkan mentega, dan air sedikit saja--Tambahkan garam dan kaldu jamur lalu tumis hingga harum--Masukkan ayam pok pok yang sudah digoreng tadi lalu tumis bersama saos telur asin--Angkat lalu sajikan--",765_ayam_pok_pok_saos_telur_asin.jpg,,
766,ayam,Mie Ayam Kuuhh,1/2 ekor Ayam bagian Dada (potong kecil)--1/4 ceker ayam (buat tambah2)--Bawang merah--Bawang putih--1 Bawang bombay (iris sedeng)--Lada bubuk/merica--Kemiri--Ketumbar--Kunyit--Jahe--Garam + penyedap royco--Gula pasir + gula jawa--Air--Daun salam + Daun jeruk--Sereh (geprek)--Lengkuas/Laos (geprek)--Pelengkap ;--Mie keriting--Sawi hijau--Daun bawang--Bawang goreng--Kecap manis--Saos extra hot--Sambel rawit--Tambahan toping ;--Telor puyuh--Bakso--Pangsit--,"Awal mula tumis bawang bombay dulu..trus semua bumbu dapur yg sudah di uleg sampai halus sy campurkan.. (tumis dengan minyak goreng + tambahan blue band sedikit..)--Setelah harum wangi masukan sereh/lengkuas/daun salam/daun jeruk..--Masukan Ayam dada + ceker..aduk2 sampai semua tercampur..--Tambahkan air..lalu masukan gula pasir/garem/royco/lada bubuk..tutup masak hingga setengah mateng..--Lalu masukan gula jawa dan kecap manis..masak lagi hingga matang.--Mie keriting di rebus di air yg mendidih bersamaan dgn sawi hijau..sebentar saja lalu angkat..--Tambahkan deh ayam nya yg sudah matang,daun bawang iris,bawang goreng merah..--Tinggal tambah2 kecap/ sambel rawit/saos pedaass--Sesuai selera taburan pangsit, masuk2 bakso,telor puyuh,ceker ayam hihi..--",766_mie_ayam_kuuhh.jpg,,
767,ayam,Pedesan Ayam,"1 kg ayam (cm pny 7 potong ayam)--2 lembar daun salam--1 batang sereh, geprek--1/2 bungkus kara kecil--secukupnya gula, garam, penyedap--secukupnya air--bumbu halus:--1 genggam munjung rawit hijau--10 siung bawang merah--3 siung bawang putih--","Tumis bumbu halus, salam n sereh dg 3 sdm minyak goreng, hingga harum dan tdk langu, masukkan ayam, aduk hingga brubah warna, masukkan air hingga stengah merendam ayam, biarkan mendidih dan air agak menyusut, masukkan santan, garam, gula, penyedap, aduk rata, biarkan hingga kuah susut, mengental dan ayam empuk. Koreksi rasa, jika sdh pas, matikan api, sajikan...enjoyy--",767_pedesan_ayam.jpg,,
768,ayam,Ayam Serai Kukus,"1 ekor ayam kampung--4 sendok makan kecap asin--2 sendok makan saus tiram--1 sendok makan madu--4 siung bawang merah, kupas--3 batang serai--3 cm jahe, potong korek api--2 sendok makan tepung maizena--Air--","Campurkan kecap asin, saus tiram dan madu.--Lumuri ayam dengan bumbu tadi. Diamkan selama 20 menit--Ambil satu batang serai, potong potong sepanjang 3 cm.--Masukkan jahe, serai dan bawang ke dalam ayam.--Potong serai memanjang sebagai alas di piring untuk mengukus.--Letakkan ayam di atas serai.--Kukus selama 45 menit.--Angkat, keluarkan isinya. Sisihkan dulu--Ambil cairan dari piring untuk saus.--Panaskan wajan, masukkan cairan tadi.--Cairkan maizena dengan sedikit air.--Masukkan ke dalam bumbu tadi.--Masak sampai mengental.--Sajikan ayam dengan saus.--",768_ayam_serai_kukus.jpg,,
769,ayam,Fillet Ayam Saus Lada Hitam,"1/2 kg dada ayam (tanpa tulang)--1 butir telur--Tepung serbaguna (sajiku, sasa dsb)--2 bks saory saos lada hitam--1 bawang bombay--Paprika (aku skip)--2 Cabe merah--Bumbu marinasi:--4 siung bawang putih (haluskan)--1 sdm ketumbar bubuk--1 sdm lada bubuk--1 bks royco--","Cara membuat fillet: Potong agak tipis2 dada ayam. Bentuknya sesuai selera ya..klo saya di bikin persegi panjang--Daging yg sudah di potong saya pukul2 pke punggung pisau (di geprek) biar bumbunya meresap dan dagingnya empuk--Stlah di geprek tambahkan bumbu marinasi nya. Di aduk rata--Masukan ke dlm kulkas kurleb 1 jam--Celupkan daging fillet nya ke dlm telur trs masukan ke dlm tepung--Goreng dlm minyak yg agak bnyk dan api sedang, stlah matang angkat dan susun dlm piring--Cara membuat saus lada hitam: tumis bawang Bombay paprika cabe merah smpe setengah matang, kemudian masukan saory saus lada hitam, tambahkan sedikit air..--Angkat dan siramkan saus lada hitamnya ke atas fillet ayam nya--Fillet ayam lada hitam siap di hidangkan--",769_fillet_ayam_saus_lada_hitam.jpg,,
