Id,Category,Title,Ingredients,Steps,URL,Type,Temp(cold)
472,ayam,Abon Ayam,"4 bh fillet dada ayam rebus tambahkan 1 sdt garam,2 lbr salam--Bumbu halus--6 siung bawang putih--1 sdt garam--1 sdt ketumbar sangrai--4 bj kemiri--Bahan pelengkap--70 gr gula merah sisir halus--50 gr gula pasir--2 sdm air asam jawa--100 bawanv merah iris--","Tumbuk ayam yg sdh direbu--Masukkan dalam baskom ayam,bumbu halus dan bumbu pelengkap aduk rata--Goreng dengan minyak sampai abon tenggelam,sambil diaduk terus ya...masaknya lebih kurang 1 jam,pakai api kecil ya...--Supaya dapat abon dengan warna bagus labih bagus pakai gula kelapa saya ini pakai gula tebu makanya warnanya hitam--Setelah masak turiskan, lalu angin anginkan tidak tempat yang belubang,saya pakai dandang sambil di tekan tekan dengan garpu spy minyaknya keluar....--",472_abon_ayam.jpg,,
473,ayam,Ayam Goreng Pandan Thailand Gai Hor Bai Toey,"500 gr Fillet Paha Ayam--Daun Pandan--Bumbu Marinasi--4 siung Bawang Putih, haluskan--1 ruas Jahe, haluskan--1 sdt Ketumbar, haluskan--3 bth Sereh, ambil bagian putih & haluskan--3 sdm Gula Aren--1 sdm Minyak Wijen--2 sdm Kecap Asin (Kikkoman)--2 sdm Kecap Manis--1/2 sdt Merica Bubuk--1 sdt Gula Pasir--1 sdm Kecap Inggris--1 sdt Garam--4 sdm Air Daun Pandan (dr 4 lbr Daun Pandan + air)--Bahan Saus--1 sdm Cuka Putih--1 sdt Gula Pasir--1 sdm Kecap Asin--1 sdt Minyak Wijen--3 buah Cabe Merah Keriting--Garam--Kaldu Jamur--","Potong fillet ayam agak kecil, tusuk2 dengan garpu & campur dengan semua bumbu marinasi. Diamkan min 1 jam (Sy semalaman)--Bungkus ayam dengan daun pandan. Pakai tusuk gigi/lidi kecil utk memastikan ayam terbungkus rapi--Goreng ayam hingga matang--Utk saus: haluskan cabe & campur dgn semua bahan saus--",473_ayam_goreng_pandan_thailand_gai_hor_bai_toey.jpg,,
474,ayam,Nugget Ayam Wortel Ala Denok,1/2 kg ayam--1 butir telur ayam--2 buah wortel--3 sdm tepung kanji atau maizena--2 sdm tepung terigu--3 butir bawang putih--1 sdm lada bubuk--1 sdm royco rasa ayam--2 sdm garam--Adonan tepung terigu encer--1/4 tepung roti atau panir--,Giling ayam dan wortel atau kalau aku sih di blender dan telur--Lalu taruh di baskom dan campur dengan bawang putih yg telah di haluskan dan bumbu lainnya--Campur hingga rata semua bumbu dan beri minyak--Siapkan tempat mengujus yg di lapisi minyak dan pengukusan--Lalu kukus 20 menit--Setelah itu potong sesuai selera dan balur i tepung terigu yg menjadi adonan dan tepung panir--Masukkan dalam kulkas 1jam--Lalu goreng dan siap dihidangkan dengan saos atau mayo sesuai selera--Selamat mencoba --,474_nugget_ayam_wortel_ala_denok.jpg,,
475,ayam,Chicken Katsu Sushi Goreng,4 centong nasi putih yang baru matang dari rice cooker--4 lembar nori--1 chicken katsu potong 4 panjang--1 butir telur didadar potong panjang--4 lembar daun bayam rebus sebentar--1 buah wortel belah 4 rebus sebentar--Sejumput garam--50 gram tepung terigu--100 ml air matang--1 mangkuk kecil tepung panir orange--secukupnya Minyak untuk menggoreng--,"Tata nasi baru matang diatas sushi roller yang sudah dilapis plastik. Tekan2 rata agar mudah digulung. Beri topping : 1 lembar nori, chicken katsu, telur, bayam & wortel lalu gulung sambil ditekan.--Celupkan sushi yang sudah diroll kedalam larutan air & terigu yang diberi sejumput garam. Lalu gulingkan di tepung panir hingga rata. Sisihkan.--Goreng dengan minyak diteflon agar tidak lengket, api panas kecil saja agar tidak mudah gosong. Angkat jika sudah matang rata.--Tiriskan dengan tisu makan agar tidak berminyak.--Tips memotong : beri sedikit olive oil untuk melapisi pisau sebelum digunakan memotong agar sushi mudah & mulus saat dipotong. Boleh pakai minyak goreng baru.--Siap disajikan dengan kecap jepang/shoyu, atau kecap asin, mayonaise, saus tomat & sambal botol sesuai selera. Untuk resep chicken katsu ada diposting terpisah.--",475_chicken_katsu_sushi_goreng.jpg,,
476,ayam,Tengkleng Ayam Khas Solo,"1 kg tulangan ayam rebus yg ada sedikit dagingnya+ sayap ayam--5 buah cabe rawit (boleh lebih ya, saya tinggal dikit)--2 lembar daun salam--2 lembar daun jeruk--3 cm jahe, geprek--2 batang serei, geprek--1,5 liter air--2 sdm gula merah (saya ganti pake kecap)--Secukupnya garam, kaldu bubuk--Bumbu halus :--8 siung bawang merah--6 siung bawang putih--1 sdt ketumbar--1/2 sdt jinten--1 ruas kunyit--4 butir kemiri--5 buah cabe merah (boleh ksh rawit kalo pgn pedes bgt)--Secukupnya minyak untuk menumis--","Tumis bumbu halus dan semua rempah sampai wangi, beri air. Lalu masuk tulang ayam, garam, gula/kecap, kaldu bubuk. Setelah mendidih, kecilkan apinya. Masak terus dgn api kecil sampai keluar minyak2 merahnya. Koreksi rasanya, matikan api. Siap disajikan.--",476_tengkleng_ayam_khas_solo.jpg,,
477,ayam,Ayam Saos Padang,"1 ekor ayam--1/2 sdt garam--1/2 sdt lada bubuk--1 jeruk nipis--Bahan halus--8 siung bawang merah--6 siung bawang putih--4 buah cabe merah besar--Bahan saos--6 sdm saos sambal--4 sdm saos tomat--2 sdm saos tiram--secukupnya Air--2 sdt tepung maizena--secukupnya Gula garam lada--Bahan pelengkap--1 bh bawang bombay, iris--1 batang daun bawang, iris tipis--3 bh cabe hijau besar, iris serong--","Lumuri ayam dengan garam, lada, dan jeruk nipis, sisihkan 30mnt--Tumis bahan halus hingga matang, masukkan bahan saos hingga meletup""--Masukkan ayam, biarkan hingga bumbu meresap--Tambahkan bahan pelengkap hingga setengah layu--Sajikan--",477_ayam_saos_padang.jpg,,
478,ayam,Minyak Ayam Untuk Mi Ayam,1/2 kulit ayam dan lemak ayamnya--200 ml minyak goreng--4 siung bawang putih--1/2 sdm ketumbar butiran (aku pakai yg bubuk)--2 cm jahe (aq pakai bubuk jahe)--1 cm kunyit (aq bubuk kunyit)--,"Cuci bersih kulit dan lemak ayam, geprek semua bumbu--Goreng kulit dan lemak ayam dalam minyak pakai api keciiill ajah, kalo uda mau kering masukkan bawang putih geprek dan bumbu lainnya, tunggu hingga kulit kering kecoklatan--Saring minyak, simpan dalam wadah kedap udara, sisa kulitnya bisa dimakan kayak keripik --",478_minyak_ayam_untuk_mi_ayam.jpg,,
479,ayam,Kwetiau Ayam,"2 buah dada ayam rebus, suir-suir--1 bungkus kwetiau basah, cuci, siram dengan air panas--1 ikat sawi hijau, cuci bersih, potong2, rebus sebentar--1/4 kg toge cuci bersih, seduh dengan air panas--Bumbu tumisan ayam:--10 siung bawang merah--4 siung bawang putih--1/2 sendok makan merica bubuk--1 ruas kecil jahe--1 ruas kunyit--3 buah kemiri digoreng/sangrai--2 lembar daun jeruk purut--1 lembar daun salam--1 batang kecil sereh digeprek--Bumbu minyak ayam:--4 siung bawang putih digeprek--secukupnya Kulit ayam atau lemak ayam--100 cc Minyak sayur--Bahan tambahan:--secukupnya Daun bawang dirajang halus--secukupnya Bakso sapi atau bakso ikan rebus sampai matang--Saos sambal--secukupnya Minyak sayur--secukupnya Air--secukupnya Kecap asin/kecap ikan--secukupnya Kecap manis--secukupnya Air rebusan ayam--secukupnya Garam--secukupnya Gula pasir--secukupnya Kaldu ayam bubuk--","Haluskan bumbu untuk ayam, tumis bumbu sampai matang dan harum, masukkan daun salam, daun jeruk dan sereh kemudian masukkan ayam aduk rata--Masukkan air rebusan ayam, kemudian beri kecap manis, garam, gula pasir dan kaldu ayam bubuk, masak sebentar aja (saya suka yg banyak kuah ayamnya biar ngga pakai kuah lagi nanti), tes rasa jika sudah ok matikan kompor, sisihkan--Panaskan minyak sayur, jika sudah panas masukkan kulit ayam atau lemak ayam masak sampai kulit ayam matang baru masukkan bawang putih yg sudah dicincang sampai harum dan matang, sisihkan--Tata dimangkok beri 2 sendok makan minyak ayam dan 2 sendok makan kecap ikan(yg ada distok), beri kwetiau secukupnya, taoge dan sawi hijau yg sudah direbus aduk rata, beri diatasnya tumisan ayam secukupnya, bakso, daun bawang dan saos sambal--Hidangkan selagi panas--",479_kwetiau_ayam.jpg,,
480,ayam,Perkedel Tahu Cina Ayam,Ayam fillet 4 slice kecil/1 potong dada ayam--Tahu sutra besar/tahu cina--Kucai seiket kecil--Bawang putih 4siung sedang--1 butir Telur--secukupnya Garam--optional Kaldu jamur/totole--5 sdm Tepung terigu segitiga full--,"Pakai food processor tinggal masukin semua bahan kecuali telur dan terigu serta garam dan kaldu jamur--Kucai biar cantik jadinya di iris halus dlu baru dimasukan ke dalam Fp--Udh halus, keluarkan dr Fp tambahkan telur aduk rata--Tambahkan terigu, garam dan totole aduk rata, tekstur lembek gt--Goreng di minyak agak banyak, pakai sendok 2 bh buat ambil dan dorong bahan ke minyak, bentuknya emang ga cantik bgt krn ga pake bentuk2.. Tapi rasanya dijamin enak.. --",480_perkedel_tahu_cina_ayam.jpg,,
481,ayam,Ayam Geprek Setan,1/2 kg ayam--Secukupnya minyak goreng--Bahan Halus--4 butir bawang merah--2 butir bawang putih--Seruas jahe dan kunyit--1/2 sdt ketumbar--1/2 sdt perasaan air jeruk nipis dan sedikit garam--Bahan sambel--20 butir cabe rawit merah--5 butir cabe merah keriting--2 butir bawang putih--6 butir bawang merah--1 buah tomat--1 sdt air jeruk purut--Secukupnya garam--,"Siapkan semua bahan Cuci bersih ayam,lalu kasih perasan air jeruk nipis + garam remes2 ayam supaya air jeruk dan garam meresap,kemudian blender bahan halus tuang ke ayam lalu tambahkan air ungkap sampai bumbu meresap atau sampai air habis, sisihkan atau tunggu dingin.--Sementara itu dipanci lain rebus bahan sambel sampai cabe agak menggembung atau tomat nya sudah mengelupas, angkat sisihkan.--Panaskan minyak goreng, lalu goreng ayam sampai kuning keemasan.--Penyelesaian, ulek semua bahan sambel agak kasar lalu ambil ayam langsung geprek ke atas ulekan dan lakukan bolak balik, lakukan sampai habis ayamnya, kalau yang pengen simpan juga bisa sewaktu2 tinggal geprekin aja.--Siap dinikmati dehh, dengan lalapan atau sayur lainnya--Pedesss nya fulll bikin air mata sesekali keluar nahan pedesnya dan mangap2 juga tapi bikin ketagihan --",481_ayam_geprek_setan.jpg,,
482,ayam,Ayam Penyet Homemade,1 buah ayam goreng--Bumbu Penyet :--2 buah bawang putih--5 buah cabai rawit--2 cm cikur--Dan secukupnya royco--,"Goreng ayam nya terlebih dahulu hingga matang.--Sambil menggoreng,sambil menghaluskan bumbu nya setelah ayam nya matang sisihkan terlebih dahulu.--Setelah bumbu nya halus,beri minyak bekas menggoreng ayam tadi yg masih panas sekitar 2 SDM saja.--Setelah tercampur rata,baru penyet berserta ayam nya --Ayam Penyet Homemade siap dihidangkan Nikmat dihidangkan dengan nasi hangat --Happy cooking Mom --",482_ayam_penyet_homemade.jpg,,
483,ayam,Ayam Lada Hitam,"Dada ayam fillet 250gr--secukupnya Air jeruk nipis--Garam--1/2 siung Bawang bombay--Bawang putih 5 siung, di cacah--Bawang merah 3 siung, iris--2 lembar Daun bawang,--Cabe rawit 3, iris (atau sesuai selera)--Bubuk lada hitam, 1 sendok makan (sesuai selera)--sejumput Merica,--1 sendok makan Saos tiram,--","Cuci bersih ayam, lumuri dengan jeruk nipis dan garam. Sisihkan--Tumis bawang putih, bawang merah dan bawang bombay--Masukkan ayam. Tumis sampe berubah warna menjadi putih--Masukkan lada hitam, saos tiram, merica dan cabe rawit iris--Tambahkan sedikit air dan masak hingga ayam empuk--Tambahkan daun bawang setelah hampir matang--Ayam lada hitam siap disajikan--",483_ayam_lada_hitam.jpg,,
484,ayam,Indomie Kuah Ayam Bawang Pedas,1 bks indomie rasa ayam bawang--1 siung daun bawang--1 bawang putih--3-6 cabai rawit setan (sesuai selera)--secukupnya Air--,"Didihkan air dalam panci secukupnya--Masukkan bumbu indomie ke dalam mangkok dan masukkan juga potong2an daun bawang--Masukkan mie ke dalam panci--Sambil menunggu mie matang, ulek bawang putih dan cabai sampai halus.--Angkat mie dan kuahnya, masukkan ke dalam mangkok.--Masukkan bawang putih dan cabai yg sudah dihaluskan tadi kedalam mangkok--Indomie ayam bawang pedas siap dihidangkan--",,,
485,ayam,Ayam Goreng Tepung Ketopad,5 pcs ayam bagian paha atas--1 sdm ACV--1 sdm garam--Bahan kering :--100 gr tepung keto--1 sdt bubuk Kaldu (saya pakai royco Ayam)--1 sdt merica bubuk--Bahan basah :--3 btr putih telur kocok lepas--,"Cuci bersih Ayam lalu beri ACV dan garam biar kan selama 15 menit, kemudian bilas dengan air bersih dan an tiriskan.--Campur bahan kering aduk rata--Rendam ayam dalam putih telur lalu balur dengan tepung sambil ditepuk tepuk sampai seluruh bagian tertutup.--Siapkan minyak goreng dalam panci supaya ayam terendam dalam minyak panas lalu goreng dengan api kecil hingga berwarna kecoklatan--Tiriskan Minyak lalu tuang saos diatas permukaan ayam goreng.--Sajikan selagi hangat--",485_ayam_goreng_tepung_ketopad.jpg,,
486,ayam,Sup Ayam Rempah,500 grm paha ayam lumuri dg acv--7 siung bawang putih(geprek)--3 tangkai Bawang daun potong kasar--1 tangkai daun seledri--1 jari kayu manis--1/2 sdt lada bubuk--1/2 ibu jari jahe--1 liter air--Secukupnya garam royco dan diabetasol(kl suka manis)--Secukupnya Bawang goreng utk taburan--,Didihkan air hingga mendidih dan masukkan Bawang putih geprek jahe kayu manis dan lada--Masukkan ayam yg sdh di Potong dan dilumuri acv ke dlm rebusan air rempah sambil tambahkan Bawang daun dan biarkan mendidih hingga ayam empuk dan kuah kaldu menyusut dan berlemak--Tambahkan garam royco dan diabetasol (optional) aduk2 dan tes rasa--Tambahkan daun seledri yg sdh di rajang halus dan matikan kompor--Sajikan dg taburan Bawang goreng dan sambal sbg pelengkap--,486_sup_ayam_rempah.jpg,,
487,ayam,Ayam Geprek,"1 buah dada ayam--1 bungkus tepung ayam merk kobe--Secukupnya garam, gula, merica--Bahan sambal;--20 buah cabe rawit--6 buah cabai merah besar--5 buah bawang merah--2 buah bawang putih--1 buah tomat--","Rendam ayam dengan garam, bawang putih dan merica kurang lebih 20-30menit--Buat adonan tepung jadi 2 bagian. Kering dan basah--Celup ayam ke adonan basah lalu ke adonan kering. Ulangi 2 kali--Goreng ayam hingga kuning kecoklatan. Tiriskan--Sambel : potong kasar semua bahan lalu tumis hingga layu--Setelah layu, tambahkan gula, garam sesuai selera. Lalu uleg--Tuangkan sambal keatas ayam yg telah digoreng tadi lalu ditekan menggunakan ulekan (digeprek)--",487_ayam_geprek.jpg,,
488,ayam,Ayam Teriyaki Ala Hokben,1/2 dada ayam--1 bawang bombay--3 siung bawang putih--4 cabe merah (opsi)--jeruk nipis--tepung maizena--bumbu rendaman :--saori teriyaki--garam--lada--,"Rendam dada ayam dengan jeruk nipis tunggu 10 menit lalu cuci dada ayam--Setelah dicuci beri saori teriyaki, garam dan lada diamkan selama 15 menit untuk bumbu agar meresap--Potong bawang bombay diiris,cabe merah dan bawang putih. lalu ditumis hingga layu--Lalu masukan rendaman ayam dengan bumbu yang ditumis tadi beri secukupnya air dan maizena--Koreksi rasa--Masakan siap disajikan--",488_ayam_teriyaki_ala_hokben.jpg,,
489,ayam,Ayam Goreng Padang,1 ekor ayam--Bumbu Halus--4 siung Bawang Putih--1 ruas Lengkuas--1 ruas Kunyit--1/2 sdt Merica--Secukupnya Garam--2 sdm Air Perasan Jeruk Nipis--2 ruas Lengkuas (diparut)--2 butir Telur Ayam--Secukupnya Garam--,"Haluskan bumbu halus--Untuk rendaman ayam, campurkan bumbu yg sudah dihaluskan td dengan air perasan jeruk kedalam ayam yg sidah dipotong--Diamkan ayam yg sudah direndam bumbu dan air perasan jeruk nipis dan garam selama 30 menit--Kocok telur dengan parutan lengkuas--Lalu celupkan ayam kedalam kocokan telur tadi,kemudian goreng hingga matang--Ayam siap dinikmati--",489_ayam_goreng_padang.jpg,,
490,ayam,Palekko Ayam,"1 kg ayam negeri (ayam kampung lebih enak)--40 buah cabe rawit--8 buah bawang merah--4 buah bawang putih--1 bks kecil merica--secukupnya asem jawa,kunyit bubuk,garam,penyedap--","Potong potong kecil ayam,cuci bersih,lalu lumuri dgn asem jawa yg sdh dcmpur dgn sdkit air--Haluskan bawang merah,putih,rawit,--Campur potongan ayam dgn bumbu halus,tmbahkan merica,kunyit,garam n penyedap beserta air sckupx--Masak smpai airx habis(klo suka kering)dengan api sedang--",490_palekko_ayam.jpg,,
491,ayam,Sate Taichan Ayam Bakar,Untuk sate:--1 kg ayam fillet (dada ayam)--1 buah jeruk nipis--5 siung bawang putih--3/4 sdt garam--1/2 sdt penyedap rasa--3/4 sdt lada bubuk--Untuk sambal:--25 buah cabai rawit *sesuai selera aja*--5 siung bawang merah--1/2 buah jeruk nipis--1/2 sdt garam--1/2 sdt gula pasir--1/4 sdt penyedap rasa--,"Potong dadu dada ayam fillet yang sudah dicuci bersih. Taruh kedalam baskom.--Haluskan bawang putih terlebih dahulu.--Setelah bawang putih halus, campurkan semua bahan untuk sate diatas kedalam baskom yang sudah berisi ayam tadi.--Agar bumbu lebih meresap, diamkan -+30 menit. *kalo mau langsung juga ga apa*--Setelah didiamkan 30 menit, tusuk-tusuk ayam di tusukkan sate yang sudah siapkan.--Bakar/panggang sate yang sudah siap dimasak. Jangan lupa dibolak-balik saat membakar agar tidak gosong karena satenya cepat matang.--Setelah sate matang, siapkan bumbu untuk membuat sambal.--Rebus kedalam air mendidih cabai rawit dan bawang merah.--Setelah keduanya agak layu, angkat.--Campurkan semua bahan untuk sambal, termasuk cabai rawit dan bawang merah yang sudah direbus.--Haluskan semua bahan dan bumbu untuk sambal tersebut. *boleh diulek atau mau pakai blender juga boleh*--Setelah semua siap, sate taichan ayamnya siap dinikmati deh!--",491_sate_taichan_ayam_bakar.jpg,,
492,ayam,Ayam Geprek Pedas,Bahan ayam :--1/2 kg dada ayam--Bumbu belender :--3 siung Bawang putih--1/2 sdt lada putih--Bahan pencelup :--400 cc air es--1/2 sdt baking powder--1/2 sdt garam halus--Tepung kering :--1/2 kg Terigu protein rendah--1/2 sdt lada--1/2 sdt kaldu bubuk--Minyak untuk menggoreng--Bahan sambal :--5 buah bawang putih besar--20 buah cabe merah--10 buah cabe rawit besar--1 sdt garam--1/4 sdt gula--8 sdm minyak panas--,"Marinasi ayam dgn bumbu blender, simpan kulkas min 1 jam--Buat tepung kering, celupkan ayam ke tepung kering--Buat bahan pencelup, celup ayam ke bahan penyelup, gulingkan ke bahan tepung kering--Goreng di minyak panas--Bahan sambal: ulek bawang putih beserta garam dan gula, setelah halus masukan cabe, ulek kasar, masukan minyak panas--Letakan ayam di atas ulekan sambal, geprek2 dak lumuri sambal ke ayam--Siap disantap pake nasi panas--",492_ayam_geprek_pedas.jpg,,
493,ayam,Steak Ayam Crispy Saos Barbeque,1/2 kg dada ayam filet--Tepung crispy--Bahan saos barbeque :--1 buah bawang bombay--5 siung bawang putih--Lada hitam / putih (tumbuk kasar)--1 sdm kecap inggris--1 sdm kecap manis--4 sdm saos tomat--1 sdm tepung maizena--200 ml air--1 sdm saos tiram--secukupnya Garam--secukupnya Gula--1 sdm margarine--,"Goreng dada ayam filet dengan tepung crispy hingga warna menguning / matang--Cara membuat saos barbeque : cincang bawang bombay dan bawang putih--Panaskan margarine (tumis bawang bombay dan bawang putih hingga mengharum)--Tambahkan saos tomat, kecap inggris, kecap manis, saos tiram.--Taburi lada yg sudah di tumbuk kasar.--Encerkan tepung maizena dengan air (campurkan)--Aduk rata saos barbeque hingga mendidih dan mengental. (Uji rasa)--Siram ayam crispy dengan saos barbeque.--Tambah rebusan wortel dan buncis (hidangkan)--",493_steak_ayam_crispy_saos_barbeque.jpg,,
494,ayam,Pepes Ayam Daun Kemangi,Bahan inti :--1 ekor ayam (potong 8)--3 bh cabe merah besar--10 bh cabe merah keriting--5 bh bawang merah--3 siung bawang putih--1 ruas jari kunyit--1/2 ruas jari jahe--5 bh kemiri--secukupnya Garam--secukupnya Penyedap rasa--secukupnya Gula pasir--Bahan pelengkap :--1 bh tomat/belimbing sayur (potong 8)--8 bh cabe rawit--1 ruas jari Serai krg lbh--Daun salam--Daun kemangi--Daun pisang--Tusuk gigi--,"Haluskan semua bumbu inti--Masukan ke dlm potongan ayam, aduk rata--Siapkan daun pisang, masukan bahan inti tsb dan tambahkan bahan pelengkap--Bungkus dan kukus krg lbh 15 menit--Setelah masak, angkat dan panggang hingga daun pisang berwarna kecoklatan--Pepes ayam daun kemangi siap di hidangkan.--",494_pepes_ayam_daun_kemangi.jpg,,
495,ayam,Ayam Lada Hitam,"250 gram ayam filet, potong dadu--2 siung bawang putih, cincang--1/4 buah bawang bombai, cincang--100 ml air--3 sdm saus lada hitam--1 sdm saus tiram--1/4 sdt penyedap--1 batang daun bawang, iris--1 sdm maizena, cairkan dengan sedikit air--","Tumis bawang putih dan bawang bombai hingga harum--Masukkan ayam. masak hingga berubah warna--Tuangkan air--Masukkan lada hitam, penyedap dan saus tiram. koreksi rasa--Masukkan irisan daun bawang, aduk rata--Masukkan maizena, masak hingga kuah mengental. matikan api.--",495_ayam_lada_hitam.jpg,,
496,ayam,Ayam Geprek,250 gr dada ayam--300 gr tepung terigu--100 gr tepung maizena--1 sdt kaldu bubuk--1/2 sdt garam halus--1/2 sdt merica bubuk--70 ml air--Minyak untuk menggoreng--7 siung bawang merah--7 siung bawang putih--2 buah cabe merah--7 buah cabe rawit/ sesuai selera--,"Potong ayam menjadi empat, lalu cuci bersih--Campurkan tepung terigu, tepung maizena, kaldu bubuk, marica bubuk dan garam--Ambil 5 sdm untuk tepung dan beri 50 ml air--Ambil 1 potong ayam lalu celupkan di tepung basah kemudian gulingkan di tepung kering. Lakukan hal yang sama pada potongan ayam lainnya--Panaskan minyak hingga benar benar panas lalu kecilkan api. Goreng ayam hingga berwarna kuning keemasan--Sambil menunggu ayam, rajang bawang merah, bawang putih, cabe merah dan cabe rawit lalu tumis sebentar agar tidak terlalu kering--Haluskan bahan yang sudah ditumis, lalu geprek ayam diatasnya --Huwalah, ayam geprek ala CooKing siap dihidangkan --Menyajikan ketika hangat lebih nikmat --",496_ayam_geprek.jpg,,
497,ayam,Ayam Sambal Balado,1 kg ayam--15 buah Cabe merah--5 buah Bawang merah--3 buah Bawang putih--Buah keras/ kemiri 3 biji--1 sdm Kunyit bubuk--Garam--Micin--Gula--Minyak goreng--,"Haluskan bawang putih 1 buah dan kemiri 3 bji--Campurkan garam dan micin secukupnya--Tuang bumbu halus tdi kedalam ayam dan tambahkan kunyit bubuk.--Aduk hingga rata dan diamkan agar bumbu meresap--Setelah meresap. Goreng hingga matang.--Setelah itu kita buat bumbu balado. Caranya ialah :--Tumbuk kasar cabe merah,bawang merah dan bawang putih. Taruh garam micin dan gula 1sdt.--Tuang minyak goreng lalu masukkan bumbu balado dan tumis hingga harum--Tmbahkan garam,gula, dan micin serasa rasanya--Jika rasa sudah cukup lalu masukkan ayam yang telah digoreng tadi.--Aduk ayam agar menyatu dengan sambal dengan api kecil yang masih menyala.--Setelah keluar minyak. Matikan kompor.--Hidangan siap untuk disajikan--Maafkan jika ada kata yang sulit karena saya masih terlalu muda dan belum ahli--",497_ayam_sambal_balado.jpg,,
498,ayam,Ayam Crispy Saus Pedas Manis,Ayam 500gr (sy pakek sayap ayam buang ujungnya)--Tepung bumbu pedas (saya pakek kobe)--Bawang bombay--4 bawang merah--2 bawang putih--10 cabe rawit (sesuai selera)--1 sdm saori--2 sdm saus tomat--3 sdm saus sambal--1 Timun kecil--Nanas--Gula--Garam--Lada--,"Cuci ayam kemudian potong kecil kecil--Siapkan 2 wadah, 1 untuk adonan basah tepung pedas dan 1 untuk adonan kering. Ayam masukan ke adonan basah kemudian adonan kering, kemudian goreng hingga matang--Potong kecil kecil, bawang bombay, bawang putih, bawang merah, cabai--Kemudian tumis di minyak panas hingga harum, kemudian masukan saori, saus tomat, saus sambal. Tambahkan gula, garam dan lada bubuk.--Setelai matang masukan timun dan nanas yang telah di potong kecil kecil--Taruh ayam crispy di piring saji kemudian siram dengan sausnya--",498_ayam_crispy_saus_pedas_manis.jpg,,
499,ayam,Ayam Bakar Bumbu Bbq,1 / 750 gram ekor ayam--4 sdm kecap--5 sdm bubuk baberque--3 sdm kecap asin--3 sdm saos tomat--4 bawang putih--2 sdm saos teriyaki--1 saset bubuk merica--2 sdm margarine--1/4 gelas air--3 sdm air asam--,"Setelah ayam dibersihkan.lumuri dgn air jeruk nipis.diankan 1/2 jam--Rebus ayam dgn 1/4 gelas air.sebentar aja.sisihkan (air bekas ayam jgn dibuang ya..)--Rajang halus bawang putih,tumis dgn margarine.masukan ayam,beri saus teriyaki,saos tomat,kecap asin,bubuk barbegue,lada,kecap asin,aduk rata.beri 1/4 gelas air ayam.tutup rapat dan masak sm 1 jam dgn api kecil (sekali kali di balik)--Siapkan wajan teflon,panas kan sebentar,lalu masukan ayam yg td di ungkep..agak gosong2 dikit enak--Ayam ini.tdk dibakar juga tetap enak.--",499_ayam_bakar_bumbu_bbq.jpg,,
500,ayam,Ayam Sambel Geprek,1/2 kg ayam (potong 6 bagian)--3 siung bawang putih--1 sendok teh merica bubuk--3 buah ketumbar--Garam--2 bungkus tepung ayam (tepung bumbu sasa)--1 buah tomat--4 siung bawnag putih--3 siung bawang merah--2 buah cabe merah--10 cabe rawit--6 cabe rawit besar (orang bilang cabe jablay)--Gula pasir--,"Haluskan bawang putih, ketumbar, merica, garam, kaldu dan oleskan ke ayam, lalu diamkan di kulkas beberapa jam (saya 3 jam)--Keluarkan ayam, diamkan di suhu ruang--Pisahkan tepung ke 2 tempat, yang satu untuk tepung kering, yang satu untuk tepung yang di tambahkan air hingga mengental (untuk kekentalannya bisa di kira kira, untuk 1/2 bungkus tepung saya pakai +- 50ml air, jangan terlalu encer dan jangan terlalu kental)--Masukan ayam ke tepung kering, remas remas hingga tepung menutupi permukaan ayam--Ayam yang sudah di beri tepung, dimasukan ke adonan tepung dan air, pastikan semua permukaan ayam tertutup--Masukan ayam kembali ke tepung kering, renas remas lagi untuk memastikan semua bagian ayam tertutup tepung--Panaskan minyak, disini penggunaan minyak agak boros, minyak harus banyak untuk menutupi semua bagian ayam saat di goreng, dan setelah di goreng, minyak akan keruh karena tepung dari ayam--Goreng hingga keemasan, lalu tiriskan--Untuk membuat sambel, panaskan minyak, lalu goreng cabe, tomat dan bawang hingga matang dan layu--Setelah semua bumbu matang, taruh bumbuh di cobek dan tambahkan minyak sedikit dari bekas gorengan bumbu tersebut--Tambahkan garam dan gula sesuai selera. Lalu ulek semua bumbu, jangan terlalu halus, biarkan aga kasar--Masukan semua ayam yang sudah di goreng ke atas cobek lalu geprek geprek bersama sambelnya, aduk dan pindahkan ke piring--Tips lainnya, bila tidak ingin menunggu lama ayam di kulkas, bunda bisa rebus ayam bersama bumbunya, seperti proses ungkeb, proses ini hanya bertujuan agar ayam tersebut tidak amis dan memiliki rasa pada dagingnya--Tips lainnya, mengapa bunda harus meremas ayam saat di lapisi tepung, iyalaah agar tepungnya itu terlihat seperti ayam KFC renyah, karena bila asal oles, tepung ayam hanya seperti ayam yang di lapisi terigu--",500_ayam_sambel_geprek.jpg,,
