Id,Category,Title,Ingredients,Steps,URL,Type,Temp(cold)
229,ayam,Fire Chicken Wings,Bahan Ayam Goreng Tepung:--1 Kg Sayap Ayam--80 Gram Tepung Ayam Goreng Kentucky (Saya Merk: Sasa)--1 Butir Telur--Bahan Saus Fire:--200 Gram Cabai Merah--50 Gram Cabai Rawit--3 Siung Bawang Putih (Secukupnya)--8 Siung Bawang Merah (Secukupnya)--2 Buah Tomat (Ukuran Sedang)--50 Gram Saos Cabai--2 Lembar Daun Jeruk--Secukupnya Gula Merah--2 Sdm Gula Putih--1 Sdm Garam--,"Rebus sayap ayam yang sudah dibersih kan. Rebus sampai matang (Kira kira 10-15 menit)--Blander sampai halus cabai merah, cabai rawit, bawang merah, bawang putih dan tomat.--Setelah sayap ayam matang, tiriskan. Celupkan kedalam telur yang sudah dikocok lalu celupkan kedalam tepung ayam goreng. Lalu goreng sampai berwarna golden brown.--Untuk sausnya tumis bahan yang sudah diblander halus. Setelah setengah matang, masukkan daun jeruk, saus cabai, gula merah, gula putih dan garam.--Tunggu sampai matang. Setelah matang masukkan ayam goreng yang sudah matang tadi. Aduk sampai rata. Dan siap disajikan.--",229_fire_chicken_wings.jpg,,
230,ayam,Rendang Ayam,1 ekor ayam (potong2)--3 bh kentang (kupas dan potong 2)--bumbu ulek :--8 bh bawang merah--4 bh bawang putih--2 bh cabe merah keriting (sesuai selera)--1 bh kunyit--2 cm jahe--2 bh kemiri--1 sdt ketumbar--1/2 sdt lada--1/4 sdt jinten--2 bh daun salam--2 bh daun jeruk--1 bh serai (geprek)--100 ml santan kental--secukupnya gula dan garam--,"Tumis bumbu dengan minyak secukupnya sampai harum, masukkan ayam, aduk2 sampai berubah warna. masukkan santen dan air secukupnya, masak dengan api kecil dan tutup--Sekitar 15 menit kemudian masukkan kentang, masukkan garam dan gula (kira2 saja), masak sampai ayam dan kentang lunak, koreksi rasa. angkat, hidangkan dengan taburan bawang goreng--",230_rendang_ayam.jpg,,
232,ayam,Sup Ayam Telur Puyuh Ncc Untuk Si Kecil So Simple,"500 gr ayam, potong kecil--2 buah wortel, potong2--1 buah kentang, potong dadu--2 buah daun bawang, iris halus--2 buah daun seledri, iris halus--secukupnya Kol--10 butir telur puyuh, rebus kupas--1500 ml air--Bumbu halus :--1/2 sdt lada bubuk--4 siung bawang putih--1/4 sdt pala--secukupnya Garam gula--Topping :--secukupnya Bawang goreng--","Masak air dalam panci hingga mendidih masukkan ayam, dan biarkan hingga matang. Kemudian masukkan wortel dan kentang masak sebentar--Masukkan bumbu halus biarkan kuah mendidih sebentar. Masukkan kol, daun bawang, daun seledri dan telur puyuh aduk rata...beri garam dan gula koreksi rasa.--Matikan api, siap disajikan..enakkkkkk....si kecil pasti suka moms --",232_sup_ayam_telur_puyuh_ncc_untuk_si_kecil_so_simple.jpg,,
233,ayam,Ayam Kecap Sederhana,1 ekor ayam (potong 12)--10 bh cabe rawit (potong 2 memanjang)--1 bh jeruk nipis (di peras)--1 saset lada bubuk--Secukupnya garam--secukupnya Gula--secukupnya Penyedap--Secukupnya air putih--Secukupnya kecap manis--Bumbu Halus:--6 siung bawang merah--4 siung bawang putih--Secukupnya lada--,"Cuci ayam hingga bersih,campurkan ayam dengan jeruk nipis dan lada bubuk diamkan sebentar lalu ungkep.--Siapkan bumbu halus--Masukan air dan bumbu halus masak hingga mendidih, masukan ayam dan kecap aduk dan diamkan sebentar.--Masukan gula,garam dan penyedap serta cabe rawit aduk hingga rata diamkan sebentar..--Masak hingga matang--",233_ayam_kecap_sederhana.jpg,,
234,ayam,Pindang Ceker Ayam,500 gr ceker ayam--Secukup nya daun bawang--Secukup nya kemangi--1 buah tomat--1 ruas jari jahe--1 ruas jari sereh--1 ruas jari laos--3 lembar daun salam--Bumbuh yang di haluskan:--8 siung bawang merah--3 siung bawang putih--1/5 ons cabai merah kriting ( boleh di tambah kalau suka pedas--1 bungkus kaldu ayam (optional)--Secukup nya garam--Secukupnya gula--1 sdm kecap manis--1 sdt kecap asin--1 sdt terasi--3 sdm minyak (untuk menumis)--1000 ml air--,"Cuci sampai bersih ceker ayam lalu rebus sampai mendidih lalu matikan kompor dan buang air rebusan--Didihkan 1000 ml air kedalam panci lalu masukan ceker yg sdah di rebus tadi, lalu tambahkan sereh laos jahe dan daun salam--Blender bumbu yg di haluskan cabai bawang putih dan bawang merah sampai halus lalu tumis dengan 3 sdm minyak tumis bumbu sampai harum dan mateng--Lalu masukan bumbu yg di tumis tadi ke dalam panci yg berisi ceker ayam tambahkan garam gula terasi dan kaldu ayam(optional) lalu baru masukan kecap manis dan asin tunggu sampai ceker ayam mateng dan kua menyusut--Potong2 daun bawang dan tomat lalu masukan ke dalam kua ceker ayam koreksi rasa terakhir masukan kemangi dan angkat pindang ceker ayam siap di sajikan --",234_pindang_ceker_ayam.jpg,,
235,ayam,Nugget Ayam Wortel,"1 ekor ayam (fillet dagingnya saja, hasilnya kurleb 700 gr)--300 gr wortel parut kasar--6 sdm tepung tapioka--3 sdm tepung terigu--2 butir telur--bawang bombay--7 siung bawang putih--secukupnya garam--secukupnya gula--lada--1 sdt kaldu ayam--secukupnya air--tepung roti--tepung terigu untuk lumuran--minyak goreng--","Haluskan daging ayam beserta bawang putih tambah air secukupnya..air jgn terlalu banyak ya moms sekedar halus dan rata cukup.--Setelah halus pindahkan di wadah lain, masukkan kocokan telur, tepung, gula, lada dan kaldu dan aduk rata.--Masukkan di wadah tahan panas dan kukus selama 30 menit.--Setelah matang angkat dan dinginkan.--Potong saat sudah dingin.--Siapkan larutan tepung terigu dan air.--Celup nugget ke dalam larutan tepung, lalu ke dalam tepung roti, lalu sisihkan.--Diamkan sejenak agar tepung merekat.--Goreng di minyak panas hingga kecoklatan. Angkat dan sajikan.--",235_nugget_ayam_wortel.jpg,,
236,ayam,Ayam Panggang Bumbu Gulai,1 Ekor Ayam Ukuran Sedang--Bumbu Halus :--6 Buah Bawang Merah--4 Siung Bawang Putih--6 Buah Cabe Merah Keriting--2 Sdm Bumbu Gulai Siap Pakai--2 Cm Jahe--3 Cm Lengkuas--2 Batang Serai (Memarkan)--6 Lembar Daun Jeruk--2 Lembar Daun Salam--350 ML Santan--1 Potong Asam Kandis--,"Bersihkan ayam, potong menjadi empat bagian. Campur bersama bumbu halus. Aduk sampai rata.--Masak ayam dalam panci tertutup dengan api kecil bersama serai, daun jeruk, dan daun salam sampai berair. Tuang santan, sambil sesekali diaduk sampai santan habis. Angkat.--Bakar ayam di oven sambil sampai ayam mulai mongering di kedua sisinya.--",236_ayam_panggang_bumbu_gulai.jpg,,
237,ayam,Tumis Ayam Wangi,1 belah dada ayam--7 siung bawang meeah--4 siung bawang putih--10 buah cabai merah--5 buah cabe rawit (sesuai selera)--1 batang daun bawang--2 lembar daun pandan--1 bungkus tepung bumbu (secukupnya)--2 sdm terigu (larutkan dengan sedikit air dan garam)--Secukupnya garam--Secukupnya merica bubuk--Secukupnya kaldu bubuk--,"Fillet dada ayam, potong dadu. Beri sedikit air jeruk nipis dan garam agar tidak amis.--Rajang bawang merah, bawang putih, cabe merah. Potong2 daun pandan dan bawang daun, jangan terlalu kecil.--Celupkan fillet ayam ke adonan terigu yang telah dicampur air dan garam, balur ke tepung bumbu. Ulangi bila perlu. Goreng hingga matang, coklat keemasan.--Tumis bawang, cabe hingga harum. Masukkan daun pandan dan daun bawang. Tumis hingga layu. Beri garam, merica dan kaldu bubuk. Cicipi rasa. Matikan api, masukkan ayam goreng. Aduk rata.--Sajikan dengan nasi panas. Yummy..--",237_tumis_ayam_wangi.jpg,,
238,ayam,Oseng Jantung Ayam Sayur,1/4 jantung ayam--1/4 kacang panjang--1 biji wortel--Bumbu :--7 siung bawang merah--4 siung bawang putih--3 biji cabe rawit--2 biji cabe merah keriting--1 sachet saori--Gula pasir--Kecap--Royko ayam--Garam--1/2 sdt maizena--,Cuci bersih jantung ayam lalu rebus sampai matang--Siapkan bumbu : bawang merah bawang putih cabe iris tipis tipis--Siapkan wajan tumis semua bumbu sampai layu--Masukkan jantung ayam tumis tumis sebentar--Masukkan saori garam gula royko kecap sesuai selera.. Kalo saya suka agak manis--Masukkan air 1/2gelas belimbing aduk2 sebentar--Terakhir masukkan tepung maizena aduk sampai matang n masakkan jd mengental--Angkat n sajikan--,238_oseng_jantung_ayam_sayur.jpg,,
239,ayam,Ayam Kemiri Ketofy,"500 gram ayam, potong sesuai selera--1 batang serai, geprek--1 ruas lengkuas, geprek--1 sdt kecap tropicanaslim--2-3 tetes sucralose--1 sdt garam--Bumbu Halus:--5 butir kemiri sangrai--8 siung bawang merah--6 siung bawang putih--1 sdt ketumbar--1 ruas terasi keto--Secukupnya air--","Cuci bersih ayam, taburi garam dan jeruk nipis, diamkan 30 menit, cuci lagi--Tumis bumbu halus dengan serai dan lengkuas, tumis agak kering agar tidak bau langu--Masukkan kecap, sucralose, garam.. Beri sedikit air, aduk, lalu masukkan ayam--Masak dengan api kecil sampai ayam matang, bumbu meresap dan air menyusut.. Siap dihidangkan--",239_ayam_kemiri_ketofy.jpg,,
240,ayam,Ayam Kecap,250 gr ayam potong--6 siung bawang merah--3 siung bawang putih--2 buah cabe merah--15 buah cabe rawit--Lengkuas--Jahe--Daun salam--Sereh--Kecap--Penyedap rasa--Tepung maizena--Air--,"Rebus potongan ayam smpai matang--Tumis bawang merah, bawang putih, cabe merah, dan cabe rawit smpai harum--Tambahkan sdikit air, masukkan jahe, lengkuas, yg sudah digeprek. Masukkan daun salam dan sereh. Tambahkan air secukupnya--Masukkan ayam yg telah matang, lalu masak hingga meresap, tambahkan maizena agar kuah mengental--Koreksi rasa, siap dihidangkan--",240_ayam_kecap.jpg,,
241,ayam,Semur Ayam Kecap,"500 gr daging ayam--10 bawang merah--2 daun salam--4 cengkeh--1 cm kayu manis--1 tomat--Bumbu halus--3 bawang putih--2 ruas jahe--2 kemiri sangrai--1 sdt ketumbar--1/4 sdt jinten--1/2 sdt merica--1/2 sdt pala bubuk--Secukupnya garam, gula, kecap, kaldu bubuk--","Rebus daging untuk menghilangkan darah yg menempel, tiriskan. Goreng dengan api kecil setengah matang--Iris bawang merah, tomat, haluskan bumbu. Tumis bawang merah hingga harum, tambahkan bumbu halus. Masukkan daun salam, kayu manis, cengkeh dan tomat. Beri sedikit air--Tambahkan ayam yg sudah digoreng tadi, tambahkan air sampai ayam terendam. Beri garam, gula, kecap dan kaldu bubuk. Koreksi rasa.--Biarkan bumbu meresap dan air menyusut/ sesuai selera--Siap dihidangkan--",241_semur_ayam_kecap.jpg,,
242,ayam,Ayam Panggang Teflon,300 gr Ayam potong (jadi 2 potong)--Bumbu kuning :--1 siung bawang putih--1 sdm ketumbar--1/2 ruas kunyit--1 sdm garam--300 ml air--Bumbu panggang :--2 siung bawang merah--2 siung bawang putih--3 buah cabe--1 sdm garam--1 sdt lada--1 sdm masako--3 sdm kecap manis--,"Sayat ayam agar mempermudah bumbunya meresap--Haluskan semua bumbu kuning lalu masukkan ke dalam panci dan beri air, tunggu hingga mendidih--Setelah mendidih, masukkan ayam lalu rebus ayam sampai air di panci tinggal sedikit (hati hati gosong)--Haluskan semua bumbu panggang lalu masukkan ke dalam mangkok lalu beri kecap--Setelah ayam selesai di rebus, balurkan bumbu panggang ke seluruh bagian ayam--Masukkan kulkas (bukan freezer) dan tunggu hingga 1 sampai 2 jam sampai bumbu meresap--Setelah 2 jam panaskan pan dengan api kecil lalu masukan margarin secukupnya--Panggang ayam hingga masak (api kecil), jangan sampai terlalu gosong--",242_ayam_panggang_teflon.jpg,,
243,ayam,Ayam Kecap Bumbu Giling,Setengah badan ayam (1 paha dan 1 dada)--10 bawang merah--5 bawang putih--Jahe geprek dan giling--Laos geprek dan giling--5 cabe kriting merah--5 cabe rawit merah--Lada bubuk--Daun jeruk--Daun salam--Wortel / kentang/ brokoli (opsional)--Halawa bumbu probiotik perisa ayam--,"Giling semua bumbu (gamau ribet jd lgsg pke blender)--Tumis bumbu beserta jahe laos geprek, salam, daun jeruk, lada bubuk, halawa..--Setelah dikira matang bumbunya, masukkan ayam... Aduk smpe rata... Biarkan kurleb 1-2 mnt--Masukkan air, kecap, biarkan smpe mendidih danbair berkurang--Tambahkan air lagi dan kecap agak lbh berasa, garam dan sayuran--Biarkan sampe air surut atau kalau suka kering.. Biarkan sampe air habis...--Hidangkan...--",243_ayam_kecap_bumbu_giling.jpg,,
244,ayam,Gulai Ayam,4-6 paha ayam atau dada ayam--200 ml santan kental--300 ml air--5 daun jeruk--1 batang sereh--1 ruas laos--1 sdt gula--secukupnya Garam--Bumbu di blender :--3 bawang merah--2 bawang putih--5 cabe merah--2 cm jahe--5 cm kunyit--1/2 sdt ketumbar--1/2 sdt merica--50 ml minyak goreng--,"Tumis bumbu yg sudah di blender, daun jeruk, sereh, laos sampai harum dan berubah warna--Masukan santan dan air, aduk rata masak sampai mendidih--Masukan ayam, masak dgn api sedang. Tambahkan garam & gula. Masak sampai bumbu mengental.--Angkat & sajikan--",244_gulai_ayam.jpg,,
245,ayam,Opor Ayam,"6 potong sayap bagi 2 yg sudah direbus bentar--15 butir telur puyuh rebus--6 buah tahu bagi 4 lalu goreng tiriskan--6 butir bawang merah iris--3 siung bawang putih iris--3 cm jahe iris--3 cm lengkuas iris--secukupnya Merica--3 lembar daun salam--2 lembar daun jeruk--2 bungkus kara kecil--sesuai selera Garam, gula, kaldu dan air--Sayuran di rebus terpisah sesuai selera (bisa skip)--Bawang goreng untuk taburan--","Tumis bumbu: bawang, jahe, lengkuas daun salam sampai wangi--Masukan ayam yg sudah di rebus, aduk bentar. Lalu masukan santan kara, aduk sampai rata. Masukan air sesuai selera--Masukan telur puyuh rebus, daun jeruk. beri garam,gula, kaldu, merica sampai rasanya pas.--Terakhir masukan tahu. Aduk sampai rata, hidangkan dengan sayuran yg sudah di rebus terpisah dan beri taburan bawang goreng----",245_opor_ayam.jpg,,
246,ayam,Chicken Nibbles Crispy Super Easy,"Ayam potong an sayap--1,5 liter air--Penyedap rasa--1 sdt garam--Bumbu tepung--500 gram tepung terigu--300 gram tepung beras--1 sdt garam--1 sdt Chili powder--Royco rasa ayam--1 butir telur kocok lepas--2 sdm susu Cair--Minyak untuk menggoreng--1 sdm mentega--","Pertama rebus ayam kurang lebih 45 menit lalu angkat dan sisihkan. Kocok telur dan susu cair (kocok lepas) masukan ayam ke dalam telur sampai merata--Campurkan tepung beras, tepung terigu, Chili powder, royco dan garam ke dalam wadah dan aduk hingga bercampur (pisahkan wadah tepung dengan telur) lalu balurkan ayam dengan tepung--Panaskan minyak untuk menggoreng (deep fried) dan tambahkan 1 sdm margarin ke minyak panas--Goreng hingga berwarna golden atau keemasan.. selamat mencoba--",246_chicken_nibbles_crispy_super_easy.jpg,,
247,ayam,Ayam Goreng Balado,4 potong ayam (disini sy pake sayap karena tinggal nyisa ini)--Bumbu ayam goreng :--3 siung bawang merah--2 siung bawang putih--Bumbu penyedap--Air--Bumbu balado :--6 siung bawang merah--4 siung bawang putih--3 bh cabe merah--3 bh cabe rawit (boleh lebih kalo mau pedes bgt)--Tomat--Gula pasir--Garam--Mecin--,"Cuci bersih ayam--Haluskan bawang merah, bawang putih untuk bumbu ayam goreng lalu tumis tambahkan dengan royco/masako dan air masukan ayam biarkan sampai bumbu meresap lalu goreng ayam nya--Haluskan bawang merah, bawang putih, cabe rawit, cabe merah, tomat sampai halus lalu tumis bumbu untuk balado tambahkan bawang daun/kemangi lalu beri bumbu penyedap, garam, gula pasir secukupnya--Masukan ayam yg telah digoreng td kedalam bumbu balado aduk sampai rata pada semua ayam, setelah tercampur matikan kompor dan makanan siap disajikan--",247_ayam_goreng_balado.jpg,,
248,ayam,Sate Lilit Ayam Praktis,"250 gr ayam giling--1 genggam kelapa parut--1 btg serai--Minyak goreng--Stik es krim--Bumbu halus--5 btr bawang merah--3 siung bawang putih--1 buah cabe merah, buang biji--1 cm lenkuas--1/2 cm kencur--1 cm kunyit--1/2 cm jahe--1 sdm gula merah sisir--Garam, kaldu bubuk--","Tumis bumbu halus + serai sampai matang & harum. Test rasa, buang serainya--Campur semua bahan. Lilitkan adonan pd stik es krim, jgn terlalu tipis jgn terlalu tebal jg. Lakukan sampai adonan habis--Panaskan wajan teflon atau panggangan. Letakkan sate diatasnya, panggang sampai matang. Done!--",248_sate_lilit_ayam_praktis.jpg,,
249,ayam,Ayam Tepung Bumbu Original,1 kg ayam potong potong jadi 8--1 btr telor--Bumbu halus--1 sdt ketumbar--1 bks kaldu--1 ruas jari kunyit--1/2 sdt garam--Bahan tepung--500 gr tepung cakra--150 gr tepung maizena--1 bks lada bubuk--1 bks kaldu--Bumbu celupan--250 ml air--5 sdm campuran bahan tepung--1 sdt baking soda--,"Ayam diberi bumbu halus lalu simpan dalam kulkas semalaman--Buat bumbu celup....aduk semua bahan juga simpan dikulkas--Aduk jadi satu bahan tepung sampai rata--Ambil ayam lalu kasih satu butir telor aduk rata lalu gulingkan ketepung sambil diremas remas,baru celupkan ke bahan celupan batu gulingkan ketepung lagi sambil dicubit cubit...--Lalu goreng dengan api sedang dengan minyak banyak ya...--",249_ayam_tepung_bumbu_original.jpg,,
250,ayam,Risoles Rogut Ayam Super Creamy,Bahan Kulit :--150 gr terigu (segitiga biru)--300 ml air--1 butir telur--1 sdm butter (saya pakai wijsman)--1/2 sdt garam--Bahan isian :--250 gr daging cincang ayam--1 buah wortel (potong dadu)--3 sdm tepung terigu--1/2 siung bawang bombay--2 siung bawang putih (potong halus)--1/2 sdt pala bubuk--1 sdt gula--Secukupnya garam dan gula--2 sdm butter untuk menumis--Bahan celupan :--2 butir telur (kocok lepas)--Secukupnya tepung panir halus--,"Cara buat kulit : campur semua bahan jadi satu, aduk rata sampai licin tidak ada yg bergerindil.--Buat dadaran di teflon ambil 1 ciduk sayur, dgn api kecil lakukan sampai habis.--Cara buat isian : tumis bombay, bawang putih sampai harum, masukkan ayam & wortel, masak sampai berubah warna.--Masukkan terigu aduk sampai berbutir, lalu masukkan susu cair dikit2 sambil diaduk. beri lada, pala, gula, garam, kaldu, masak sampai kuah mengental lalu angkat.--Penyelesaian : ambil 1 kulit dadaran beri isian, lipat, & celupkan ke telur lalu tepung panir.--Goreng dengan minyak panas api sedang, sampai kuning keemasan--Yummy, selamat mencoba! --",250_risoles_rogut_ayam_super_creamy.jpg,,
251,ayam,Ayam Tepung Kecap,1/4 ayam--Tepung sajiku--2 Bawang putih--3 Bawang merah--1 cm jahe--Cabe rawit--secukupnya Kecap--secukupnya Air--,"Ayam dipotong kecil-kecil dan campurkan dengan tepung sajiku, goreng sampai kering lalu tiriskan--Iris tipis bawang putih, bawang merah, cabe rawit dan geprek jahe--Tumis irisan bawang, cabe dan jahe sampai wangi lalu tambah air secukupnya--Setelah air mendidih masukkan ayam dan tambahkan garam, penyedap rasa dan kecap secukupnya--Tunggu hingga kuah menjadi sedikit kental dan ayam tepung kecap siap disiapkan --",251_ayam_tepung_kecap.jpg,,
253,ayam,Opor Ayam,1 kg ayam--1 bks santan kara--Salam--Laos--Daun jeruk--Sereh--Kaldu bubuk--Gula dan garam--Merica bubuk--Air--Bumbu halus :--Bawang merah--Bawang putih--Jahe--Kunir--Ketumbar--Kemiri--,"Tumis bumbu halus bersama salam, laos, sereh dan daun jeruk--Apabila sdh harum masukkan ayam yg sudah dipotong kecil dan dibersihkan--Jika ayam dirasa sdh tercampur rata dengan bumbu tambahkan air secukupnya--Biarkan hingga ayam empuk, kemudian tambahkan merica bubuk, gula, garam dan kaldu bubuk--Beri santan dan koreksi ras--Hidangkan dan taburi bawang goreng lebih nikmat--",253_opor_ayam.jpg,,
254,ayam,Ayam Saos Lada Hitam,"1/4 dada ayam filet, potong dadu--2 buah bawang bombay, potong bulat--1 sdm tepung maizena--Bumbu:--3 siung bawang putih--1 sdt lada hitam--2 sdm saos tomat--3 sdm saos pedas--1 sdt saos tiram--1 sdm kecap manis--1 sdt kecap asin--secukupnya Garam--secukupnya Gula pasir--","Haluskan bawang putih dan gerus kasar lada hitam.--Tumis bawang putih dan lada hitam. Lalu masukkan daging ayam.--Aduk2 sampai ayam berubah warna (api kecil saja).--Masukkan air, berbagai macam saos, kecap asin, kecap manis, garam, gula pasir.--Kentalkan kuah dengan tepung maizena yang sudah dilarutkan dengan air.--Masukkan bawang bombay. Aduk2, tunggu hingga kuah meletup2. Koreksi rasa. Angkat beri irisan daun bawang.--",254_ayam_saos_lada_hitam.jpg,,
255,ayam,Tongseng Ayam Dengan Kuah Santan Kental Yang Pedass 18,1/2 ekor ayam--Air--1 Kara--Minyak--Bawang goreng--Secukupnya irisan kobis--1 tomat belah sesuai selera--Bumbu iris :--5 bawang merah--10 rawit / sesuaikan--Bumbu halus :--5 bawang putih--2 kemiri--Seruas kunyit--Bumbu pelengkap :--1 sdm tumbar bubuk--1/2 sdm merica--secukupnya Garam--secukupnya Gula--Penyedap rasa--Daun salam--Daun jeruk--Lengkuas1 sereh geprek--Seruas jahe geprek--,"Cuci bersih ayam, lalu potong sesuai selera..--Goreng irisan bawang merah setengah matang, masukkan bumbu halus.. Tunggu hingga harum lalu masukkan daun salam daun jeruk sereh lengkuas jahe.. Kemudian masukkan cabai dan tomat.. Setelah itu masukkan ayamnya.. Adukk hingga bumbu merata..--Tuang air sedikit agar ayam cepat empuk dan matang.. Tunggu sampai air menyusut kemudian masukkan kara.. Dan tambahkan air serta merica bubuk, garam, gula, penyedap rasa--Setelah matang masukkan kobis.. Tunggu sebentar saja setelah itu tuang ke mangkok dan taburin bawang gorengnya, masakan siap untuk disajikan.--Selamat mencoba --",255_tongseng_ayam_dengan_kuah_santan_kental_yang_pedass_18.jpg,,
256,ayam,Sayap Ayam Crispy Ala2,6 potong sayap ayam (bagi 2)--4 siung bawang putih (dihaluskan)--secukupnya Garam--secukupnya Merica--Secukupnya penyedap rasa--1 butir telur--Bumbu pelapis :--5 sdm tepung terigu--2 sdm tepung maizena--,"Lumuri sayap ayam dengan bawang putih halus, garam, merica, dan bumbu penyedap. Campur dengan rata. Diamkan selama beberapa jam supaya bumbu meresap. Lebih enak lagi kalo semalaman--Jika sudah akan dmasak, lumuri dengan telur. Lalu balur ke bahan pelapis. Cubit2 ayamnya supaya tepung bisa menempel--Goreng hingga matang dan kecoklatan. Sajikan--",256_sayap_ayam_crispy_ala2.jpg,,
257,ayam,8 Egg Salted Chicken,"1 iris fillet dada ayam, potong kecil--Bumbu halus :--1 siung bawang merah--1 siung bawang putih--3 sdm tepung goreng ayam--Sedikit air dingin--Bumbu saus :--2 butir kuning telur--200 ml susu cair--1 siung bawang putih--Secukupnya garam--","Masak ayam dengan digoreng tepung seperti biasa------Kemudian buat saus telur asinnya, yg pertama campur kuning telur asin yg sudah matang dgn susu cair dan garam, kemudian tumis bawang putih lalu masukkan campuran yg tadi aduk2 hingga mendidih kemudian matikan api... Dan siram sausnya di atas ayam--Siap disantap...--Selamat mencoba--",257_8_egg_salted_chicken.jpg,,
258,ayam,Ampela Ati Ayam Sayur Genjer Saus Tiram,1 ikat sayur genjer--1/4 kg hati ampela ayam--Bumbu halus--3 siung bawang putih--4 siung bawang merah--7 Cabe rawit merah--secukupnya Gula dan garam--1 sachet saus tiram--Minyak untuk menumis--secukupnya Air--,"Cuci dan potong sayur genjer lalu rebus sekitar 1 min dan tiriskan peras air nya,rebus juga hati dan ampela ayam potong dadu--Haluskan bumbu kemudian panas kan wajan dan minyak tumis bumbu halus masukan hati ampela ayam aduk2 terakhir masukan sayur genjer,saus tiram gula dan garam secukupnya kemudian tambahkan air masak hingga matang--Koreksi rasa --",258_ampela_ati_ayam_sayur_genjer_saus_tiram.jpg,,
259,ayam,Ayam Yakinikutumis,4 ptg dada ayam(dagingnya saja)--1 buah lemon(untuk rendam ayam)--Bumbu tumis--3 buah cabai merah (iris)--2 buah cabai hijau(iris)--1 btg bawang daun (iris)--1 buah bawang bombay (iris)--1 sdm margarine--2 sdm kecap asin--1 sdm kecap manis--Bumbu halus(dibagi2):--4 siung bawang putih--1 ruas jari jahe--,"Bersihkan ayam rendam sebentar pakai lemon kemudian bilas--Lumuri ayam dengan bumbu halus--Tumis bumbu tumis, masukkan sampai harum(sisihkan)--Tumis bumbu halus sampai harum lalu masukkan ayam tambahka air secukupya--Setelah ayam hampir matang, masukkan bumbu tumis masak sebentar sekali agar cabai dan.bawang tdk layu--Siap di sajikan. Notes kalo pengen teriyaki tinggal balik porsi kecap manis lebih banyak--",259_ayam_yakinikutumis.jpg,,
260,ayam,Bestik Ati Ampela Ayam,"4 hati ampela ayam, cuci, rebus, potong2 dan goreng sebentar--1 buah kentang, potong dan goreng hingga berkulit--1 buah wortel, potong memanjang--6 buah buncis, potong panjang--Bumbu :--2 buah bawang putih--5 buah bawang merah--1 buah bawang bombay--secukupnya Minyak goreng  untuk menumis--secukupnya Air--Garam, merica dan kaldu bubuk--secukupnya Kecap manis--sedikit Pala--","Iris tipis bawang2an, tumis dengan sedikit minyak sampai kecoklatan--Masukkan buncis dan wortel, tumis sebentar--Masukkan air--Bumbui dengan garam, merica, pala, kaldu bubuk dan kecap sesuai selera--Masukkan hati ampela dan kentang goreng--Masak dengan api kecil hingga bumbu meresap dan kuah menyusut--Sajikan hangat--",260_bestik_ati_ampela_ayam.jpg,,
261,ayam,Mie Goreng Ayam Seadanya,"1/2 bungkus mie telor--1 paha ayam filet, iris tipis--1 butir telur--5 batang sawi hijau--1 sachet kecap bango--bumbu halus :--2 siung bawang putih--3 siung bawang merah--sedikit lada bubuk--secukupnya royco ayam--","Rebus dahulu mie telor dan ayam, setelah matang, sisihkan. beri sedikit minyak pada rebus mie. dan beri kecap aduk hingga rata.--Haluskan, bawang putih, bawang merah, dan lada halus, beri sedikit garam. Ulek hingga halus.--Tumis bumbu yang dihaluskan tadi hingga harum. Masukan telur, aduk rata. kemudian masukan telur, aduk - aduk hingga tercampur rata.--Masukan sawi hijau, aduk hinga benar - benar tercampur semua bahan, dan jangan lupa tambahkan royco. Masak hingga matang.--",261_mie_goreng_ayam_seadanya.jpg,,
262,ayam,Opor Ayam,1 kg ayam--2 sereh di geprek--3 daun salam--2 cm laos geprek--1 bungkus santan kara--Bumbu halus:--10 siung bawang merah--5 siung bawang putih--2 butir kemiri sangrai--1 sdm makan ketumbar sangrai--1/4 sdt jinten--1/4 sdt klabet--3 cm kunyit--5 buah cabai rawit (optional)--2 buah cabai keriting (optional)--,"Blender semua bumbu halus dengan minyak--Tumis bumbu hakus beserta sereh, laos, daun salam hingga berubah warna menjadi warna kuning tua--Sambil menumis bumbu, rebus air secukupnya--Masukkan ayam pada air rebusan yang telah mendidih. Tunggu hingga mendidih lagi--Buang air rebusan ayam pertama--Rebus kembali air beserta ayam.--Tambahkan bumbu yang telah ditumis--Masukkan santan, diaduk terus sampai mendidih--Pengadukkan dilakukan agar santan tidak pecah karena jika sesaat sebelum mendidih tidak diaduk, maka akan pecah santannya--Tambahkan garam, penyedap rasa hingga rasanya pas--Bisa ditambahkan dengan labu siam, atau kol dan kacang panjang--",262_opor_ayam.jpg,,
